conCallAns,execAnswer,execName,,AnsNo ,Avoidance,Repetition,Unprepared
ay29const_Q2_16_22,And you can call it leading or not leading. We are sort of I would say marching to our own beat as opposed to too worried about what some of our competitors are doing overall. And that's sort of up to them. And we will do what we think the market will bear for our brands and what's good for the health of our brands.,Rob Sands,,1,,,
y31_HEINY_Q4_16_55,"Yes. I want to be crystal clear on that management is appointed by the board, and has the full competence of the board to carry these forward. That's one. Secondly, SEBI has issued a executive order to this mister Chairman of the Board out of his function. It's not the will of the shareholders to do it nor on board of directors, it is just a court order that have to be executed. It's for Dr. Mallya to react on that if he wants to have a stay on that position.",Jean-Francois van Boxmeer,,2,,,
_the_Pres_09_16_108,"What we're seeing is it's positive for the brand equity. We also have figured out a lot of the principles how to merchandise, which makes sure that as you launch the new product, you use it as a big platform to merchandise your core range and drive sales of that.",John Kennedy,,3,,,
_BrownF.B_Q1_16_55,"It certainly was an element of our - what I'll call rest of the portfolio outside of the Jack Daniel's brand having a very good quarter. If you look at the - and that's a rest of portfolio, I know you are referring to Schedule B, I am talking about everything, other than Jack Daniel's. And the Tequila has had a really good quarter that might be one of the contributing factors, Woodford Reserve, it gets larger and the larger it gets and the more it grows at 26%, the more it makes contributions, it's not specifically called out here, but even contributions from brands like Old Forester, Sonoma Cutrer, et cetera. Yes, it was a good quarter for the non-Jack Daniel's brands. But I also don't want to take away from the fact that we expect the Jack Daniel's family and particularly Jack Daniel's Tennessee Whiskey over the balance of the year to post better numbers than the 3% that was in there. So, but I think it's a fair comment. I mean, it was a good quarter and there were some, as all these brands have when you just look at 90 days at the beginning of a year, you have all kinds of things that are influencing sort of a quarterly number. So, I wouldn't expect or for example, our Tequilas to continue to run at those rates for the full year. But nonetheless we do think they are performing better than they were in the recent past.",Paul Varga,,4,,,
y31_HEINY_Q2_16_16,"Competitive dynamics will change for sure and it's going to be depending on who is the acquirer but then it starts to be speculation. But specifically let me repeat to your private equity thing, typically you need also an exit for that and you would not acquire it for a cheap price in a market which is very competitive, but its only speculation.",Jean-Francois van Boxmeer,,5,,,
_may31_TSRYY_17_44,"We've also adjusted our spends down, our cost of doing business in Europe which is why we feel pretty confident we can continue to hit double digit EBITS margins because we're managing - we're matching our investments and our costs to what that portfolio is that we are selling. And I would say that double digit EBITS margin on any commercial business anywhere in the world is tremendous. So hitting 12% EBITS margin is great.",Michael Clarke,,6,,,
_BrownF.B_Q3_17_16,"I know at our company, we're a little bit more cautious, and even in the instances where we took pricing this past year with Woodford Reserve and Old Forester, in the short-term, they felt the impact on the shelf once the prices got in there, and I think it's a reflection of the fact that there are alternatives out there. I mean, there's just a lot of competition in this U.S. bourbon and spirits market, and when there's a lot of choice, it makes pricing a little bit more difficult.",Paul Varga,,7,,,
may31_TAP_Q1_16_1,"Yeah, I was going to say, Bryan, we're focused on the moment of closing the brewery down and transitioning the volume to where it's supposed to be. That's our focus, here. And we just haven't made any decisions on what to do with a facility or the land at this point.",Gavin Hattersley,,8,,,
_may31_TSRYY_17_6,"The way to think about it is we sold the Tier 2 brands at the beginning of this year that's about a 1 million cases that we've offloaded, we've not reset the prior year number, so that's the first piece. Second piece is, don't forget we are also allocating some of our wines, not only the old TWE wines which are refreshed plus the new Diageo refreshed wines we're allocating some of those wines to Asia and other parts of the world. And then we are looking at investing and growing the portfolio in both America and also in outside of America.",Michael Clarke,,9,,,
_the_Pres_09_16_111,"The comments I made about the strategy we have well executed, giving us the opportunity to sustain the performance we've had, grow market share, deliver low single-digit growth, stands. And we are getting on with executing against those with confidence and energy. Look forward to speaking to you on the next call, if not before. Take care.",John Kennedy,,10,,,
y31_HEINY_Q4_14_68,So it's a very city-by-city approach and our commercial policy is geared to go where the growth is and enhance the growth. That is -- that's basically what we are doing.,Jean-Francois van Boxmeer,,11,,,
may31_TAP_Q2_16_6,"And as for the PACC model, of course, we're constantly updating the cost of capital that we would use to analyze and review the various alternatives, i.e. should we delever, should we invest behind our brands, or should we pursue certain M&A opportunities, or should we return money to shareholders. And obviously those rates will be adjusted and are adjusted accordingly, given what's happening in the market and our outlook going forward.",Mauricio Restrepo,,12,,,
_edit_DEO_q4_14_22,"And just a follow-up on that -- and maybe this just boils down to comparison, but spirits is decelerating, at least from your perspective, on a total industry basis. Beer is accelerating. So again, it's not like spirits is losing share, but the pace of share-taking is moderating a bit. And I'm just wondering, is that a function of what's going on in vodka? Is it purely comparison? Is it the on-trade dynamic? It just seems like that trend that's been so favorable is starting to reverse a little bit in favor of beer at the expense of spirits.",Ivan M. Menezes,,13,,,
may29_DEO_q2_15_20,"Sure. Hi, Andrea. On the depletions going forward, if you look at the U.S. portfolio in total, clearly, Regal Apple had a very strong influence on the fiscal '15 performance. But we've got more momentum in the portfolio. So if you look at brands like Bulleit, our tequila portfolio, Buchanan's, etc. they're strong but the key difference makers in terms of fiscal '16 will be to get relatively better performance from Smirnoff than we had in fiscal '15. And a big one is Captain Morgan, which is your second question, which I can talk to. On Captain Morgan, firstly outside the U.S., Captain Morgan is very strong and doing very well. In the U.S., the rum category is tough and Captain is in the most recent periods, is holding share. So we've stabilized it. But as we go into fiscal '16, we have a new campaign in place, which we're very excited about. It's called GO FULL CAPTAIN and it basically says in this age where 21 to 24 years olds have a lot of anxiety and social media and digital and staying up with everyone, we're going to put the fun back into their lives with the Captain.",Ivan Menezes,,14,,,
31_Pernod_Q1_16_26,"And I think that in our mid-term objective, to obviously come back to growth in China, we're confident that Cordon Bleu will play an important role because we have Noblige well on track and on Cordon Bleu everything we're doing, everything we've been doing in the last 12 months will help to improve the performance of Cordon Bleu and XO going forwards. And in particular in the on-trade, in particular in Chinese restaurants which have a tremendous potential for Cordon Bleu going forward.",Gilles Bogaert,,15,,,
may29_DEO_q4_16_27,"Yes. Ed, on the stock question, I mean, there are some technical factors, which you'll see a bounce-back, where we had reduced stock levels. But on an ongoing basis to your question about as the emerging markets come back or scotch gets stronger, we are very focused on really having everyone's eye and measurement and incentives and data around what's selling out and depleting, and really managing the stock levels and distributors very tightly as a result.",Ivan Menezes,,16,,,
_may31_TSRYY_17_1,"Also some parts of the market not included in Aztec but if you were to look to do this but if you were going to have a conversation with I think most of our retail partners in Australia, I think they would all confirm that we have grown share in this market.",Gunther Burghardt,,17,,,
may29_DEO_q2_15_12,"Hi, Trevor, thanks. Let me take the first two questions. On the NSV guidance of mid-single digits, the way we see the world is getting the U.S. back to, let's say, mid-single digits, 4, 5, 6, and we see by F17 very much all the fundamentals that we're putting in place and the changes we're making in the U.S. with things like the Activation Army and our incubation of brands. And we'll talk more about this at the investor conference in November, so that's leg number one. Leg number two is Europe's steady. Europe has come back to growth this year, Western Europe, that's one, holding that above there.",Ivan Menezes,,18,,,
_BrownF.B_Q4_16_11,"And there was a huge surge in interest and trial associated with this product and as you can image, I just feel like just composition of the product it's not going to be for every straight whiskey drinker because it's in fact a flavored whiskey. And so I really do - it doesn't surprise us that there are tough quarters following a launch like that in a particular country. But I do feel we have the benefit of expanding it geographically to partially offset that. ",Paul Varga,,19,,,
_BrownF.B_Q1_16_66,"Well, I don't know that the boom-bust on flavored vodkas, boom was 20 years, and it busted then more recently. But the initial entries into flavored vodka back at the early days of Absolut and Stoli, to some extent Finlandia was back around then in the United States, goes back quite sometime. So, and it became a prominent part of the category growing to what I recall, something like 20% or something of the total category. I think flavored vodka today if you were to independently review it as a category it would be huge. And so, if you - of course, that took some time as well. What can we do - I can't speak as an industry, I can only speak to what we can do as a corporation and how we responsibly develop the category and the brands and the way that I feel about it is to treat the entrants in there even though they have in these cases might be line extensions as bonafide brands. And, when you do that it takes you into a consideration of how are you managing - in this case to get truly new consumption to the category and so - I kind of referenced this in my comments that we are prepared that the success we've had and I'll just use the United States in this example of being able to attract new consumers through both Jack Daniel's Tennessee Honey and from what we are seeing in the early days of Jack Daniel's Tennessee Fire, to not only the whiskey category but to the Jack Daniel's brand without cannibalizing Jack Daniel's Tennessee Whiskey. I find that it's - and we are looking at it from a bunch of different angles, it's very different than say, in the soda business of diet sodas versus mainland sodas or a light beer versus mainland beer where they are with the passage of time was considerable cannibalization as one went up and the other went down and so far because, these are occupying quite different drinking occasions, we think if you build the brands in a - I think a constructive way and have that in mind, you will have a more prolonged existence as an expression of it, in this case, the Jack Daniel's trademark. So that's what we can do. I can tell you, we are not going to be introducing a brand every three months in order to chase numbers or something like that. It's just not - it would be responsible to the Jack Daniel's trademark. I think there is a statistic we've been using that Tennessee Honey by itself, when you consider brands that average retail around the world for $25 and above, is something like the 16s or 18s or something like that largest brand because it occupies - I think at year-end it was about 1.4 million cases and that is a very significant amount of business and so, I don't want to really treat this some line extension of Jack Daniel's. You really have to think about how it can continue to be a prominent brand in the global marketplace. I think the other thing sort of - we have had some unique experience with here is that there is a lot of - of course natural focus on this emerging 7, 8 million case and growing flavored whiskey market in the United States. When you leave the United States, Tennessee Honey has played a very prominent role, it's not the lead role, in developing the flavored whiskey category outside the United States. And so, we think there - that's why we continue to test and read it very closely, so that we can expand the world that's possible for flavored whiskey from just over 300 million people to perhaps 7 billion people. We can - and so we really are taking a very long-term, even though it's a really dynamic category where there is a lot of competition, a lot of change, and a lot of new entrants that will make a bunch of noise, I think what we intent to continue to build it along the lines of the way we treated Jack Daniel's Tennessee Honey with a very long-term view and trying to create incremental value for Brown-Forman. That helps Ian?",Paul Varga,,20,,,
y31_HEINY_Q2_16_40,"That is a very good question. But at the same time, I don't think it's the place to make speculations about that. Part of what you do is strategy, part of what you do is in reaction of strategies and actions of others. That is -- and when you speak about a discretionary part of our business it is exactly that, it's the ATL and BTL it's totally discretionary. When you have to produce a hectoliter of beer, it's not discretionary.",Jean-Francois van Boxmeer,,21,,,
_may29abi_Q1_16_25,"No. I mean, it's not this year, but it's fair to say that top-line has been growing in terms of importance, top-line growth, in the past few years. Not this year necessarily, but in the past few years. Yes, it's fair to say that.",Carlos Alves de Brito,,22,,,
_BrownF.B_Q4_16_19,"I mean yes they might pull a quarter or two on the sales line or even in the operating income line a little bit from time to time, but the story at our company because of the development that I mentioned over the last decade or more around Jack Daniel's and our American whiskies is really where we are placing our emphasis today. ",Paul Varga,,23,,,
ay29const_Q4_16_6,"There is a lot of distribution gain activity or a lot of space we can gain in terms of distribution in the coming year. We do expect continued growth of cans and again, our objective remains to drive our can volume up in aggregate into that mid-teens kind of range of total volume over time.",David Klein,,24,,,
may31_TAP_Q2_16_40,"So, any quality of our copy, the promotional intensity in terms of our in-case, the roll out of the visual identity, further alignment with the U.S. creative platform, all of those things are very well. But this is a big, big brand and you don't turn things on or turn things off overnight. So, we are working this hard, and I think we're working on the right input measures, starting certainly through our brand tracking to demonstrate that we're pulling on the right levers, and I expect to see performance improve through the balance of this year and into 2017.",Mark Hunter,,25,,,
may29_DEO_q2_15_29,"So I don't know where you were going with that question, but I am very confident about our ability to drive a sustained performance in the U.S. and it does take more agility, it does take being ahead of understanding the consumer trends and that's really the direction in which we are shaping our U.S. business as we go forward. I'll just come back to Javier's question earlier. North American whiskey, just confirm the number; it is PS800 million growing at 12%.",Ivan Menezes,,26,,,
_may29abi_Q2_16_42,"Of course, you have some capacity constraints at the moment because, again, the Mexican supply capacity is being all taken by the growth we have in Mexico, by the growth Corona has worldwide in our system and now by the growth we have with Mexican imports from us into the U.S. markets. That's why we're building a new brewery there in the Yucatan Peninsula. We're very excited hopes to Jalisco. Let's see, early days, but some good signs, some good numbers to start with.",Carlos Brito,,27,,,
_may31_TSRYY_17_14,"And I think you can see in our U.S. numbers that even while we were in this fixing space in America, you can still see the profit impact by us. I'm getting greater margin appreciation on not only our existing TWE brands but also on the Diageo portfolio and we just have to take $1 price increase or get a $1 improvement in our trade spent and that goes across all the cases that we sell of Diageo's portfolio in the current period.",Michael Clarke,,28,,,
ay29const_Q1_16_36,"Yes. So just kind of to look at quarter-over-quarter and I will focus on Corona because remember, Modelo Especial is a big can brand, right. But the new launch is really focused on Corona Extra. And for Corona Extra, say first quarter last year, about 3% of our depletions were in cans and this year was about 5%.",Rob Sands,,29,,,
may31_TAP_Q2_16_51,"Okay. Well, if there are no questions, I'd just like to thank everybody for your interest in Molson Coors Brewing Company. We are poised, as we look forward, to the hopeful conclusion of the ABI and SAB transaction and our acquisition of the 58% in MillerCoors, which will be transformational for our business.",Mark Hunter,,30,,,
y31_HEINY_Q4_14_15,"Negative surprises, they come in the course of the year, where you have macro or geopolitical incidents that you didn't count on. I would say that Russia has been that surprise because the events that happened in -- between Russia and Ukraine have been hurting us, but they haven't been hurting the whole industry. ",Jean-Francois van Boxmeer,,31,,,
31_Pernod_Q4_14_12,"And it's the same for other brands, including Chivas and Royal Salute. So that's what we can say on China.",Alexandre Ricard,,32,,,
y31_HEINY_Q4_14_12,"The last point on Russia and you know that, we have been of course writing off all the goodwill of the balance sheet over the last few years, so we are just carrying active assets on the ground over there.",Jean-Francois van Boxmeer,,33,,,
_BrownF.B_Q4_16_10,"And one of the offset, just - repeat something I said a few minutes ago. One of the offsets to cycling the initial interest in trial on Jack Daniel's Tennessee Fire in the United States is the fact that we'll be introducing it to new countries, and so that is clearly a partial of that. And it's not diminishing the fact that the US market for this category is really competitive and in this particular year, in year two of Jack Daniel's Tennessee Fire reminds in some ways the prior years' where there was such interest in the prior year on the launch of something where there were some pent up demand which I felt last year in the spring particularly after we've done that staged rollout. ",Paul Varga,,34,,,
ay29const_Q4_17_27,"In fact, we are 100% of their growth okay, but Constellation okay, their businesses would be going backwards and their profits would be going backwards. Where their growth driver and in many instances today, we are their largest profit contributor period.",Rob Sands,,35,,,
y31_HEINY_Q2_16_12,"As for the country mix, you're right; it affected Asia Pacific as said and then no significant impact anywhere else.",Laurence Debroux,,36,,,
ay29const_Q3_17_23,"The Board would be completely amenable to giving us any authorization that we ask for because of the fact that David mentioned was, we think that our shares are, especially today, significantly undervalued. That said, we have $800 million left on our authorization. So it's really not much of an issue at the moment. We will continue to make share repurchases opportunistically as we have in the past and the only caveat on that is that we do desire to stay within our debt target of approximately 3.5, which is also important and to therefore maintain our investment grade ratings. So that's probably the only real caveat on making stock repurchases, but hey, we are gung ho on stock repurchases. So no on needs to convince us of that strategy.",Rob Sands,,37,,,
_may29abi_Q2_16_3,"On the other hand, the premium is growing. Consumers are trading up, so that's great news and we have the brands. We're leading the premium category. We're growing double-digits and that's encouraging, so even in a weak economy, you do have consumers that are looking for that premium opportunity. So that's Brazil. In terms of the U.S., Bud Light, while we have still a lot of work to do on Bud Light, the share trend is stable but still negative. Of course, what I can tell you, Sanjeet, is that consumers are responding positively to the theme of the Bud Light Party campaign and the roll-out which is now completed, of the new Bud Light visual identity which is much more contemporary and much more in tune with the LDA consumers.",Carlos Brito,,38,,,
_BrownF.B_Q3_16_17,"The second is, with the absence of Southern Comfort and Tuaca, our ability to take the time that we were devoting to those brand-building activities and rededicate them to our highest priorities. I made the example in my opening comments, but let's just say in this example, Jack Daniel's Tennessee Whiskey will benefit by us being able to redirect some of our time and attention and creative energies to that particular brand. That becomes, in fact, a multimillion dollar investment behind the Jack Daniel's business.",Paul Varga,,39,,,
ay29const_Q2_16_12,"Yeah. So as it relates to a new green field facility, what we've stated in the past is that, we haven't made a decision on specific location, although we are planning for Western Mexico. We haven't made a decision on size of the build-out and then we have provided a really large range of $100 to $150 a hectoliter, recognizing that a green field will be completely starting from scratch with no basic infrastructure, which we benefited from at the Nava facility. So, we will come back to you within the next several months with definitive plans around our build-out.",David Klein,,40,,,
ay29const_Q4_16_49,"And then assuming you saw positive channel mix, how much of that was driven by greater distribution in the high margin C-store channel?",Rob Sands,,41,,,
ay29const_Q3_17_4,"And on your last question, I have it here, as it relates to Ballast Point's distribution, I think Ballast Point is about 25. So ACV is about 25 and we are in about 45 states. But what I want to caution when we talk about expanding into incremental states is that if we sell a case in a state we say that we are in that state. We really need to continue to drive the sales execution and broadening of the base in each state that we go into with Ballast Point. So there is a lot of runway in front of us as it relates to Ballast Point.",David Klein,,42,,,
31_Pernod_Q2_17_11,"On your question on cost of debts yes it will go further down in the second half, partly if I get some bonds are coming to maturity and we already redeems $850 million bond in January and we are going to reimburse EUR1 billion bonds with a 5% coupon in March so this will contribute to a further decrease of the cost of debts. For fiscal year 2018 is still bit early to give you guidance, because you're trying to taking to accounts so rates increase in the U.S. but we would expect to be able to maintain lower rates maybe modestly better than the one we have for fiscal year 2017.",Gilles Bogaert,,43,,,
ay29const_Q4_17_8,"And Judy you know that pricing in beer for the most part is taken in the fourth calendar quarter of the year right. So, the pricing that -- the preponderance of the pricing that we're counting on to achieve our guidance is already in the market. ",David Klein,,44,,,
_the_Pres_09_16_22,Our third strategic priority is innovation. At this point 10% of Europe's sales now come from innovation; that's a significant increase versus three or four years ago. It has become a consistent and reliable growth driver for getting our whole Europe business back into growth.,John Kennedy,,45,,,
may29_DEO_q4_16_0,"Hi, Olivier, I'll take the first one then ask Kathy to jump in on the second. On Africa margin, yes, we were impacted by Nigeria, in particular, on the margin and in this year's organic. But going forward to your question, I do expect Africa to expand margins going forward and getting operating margin up again. So that's very much in our plans.",Ivan Menezes,,46,,,
may31_TAP_Q2_16_23,"We're working our way through that and there's a broader conversation with Gavin and the team really looking at where we want to place our bets on our own portfolio going forward, recognizing that we're kind of - we have an embarrassment of Regis with Pilsner Urquell and Peroni and [indiscernible] Staropramen potentially in the future. So, that's work that we're currently thinking our way through just now.",Mark Hunter,,47,,,
