conCallAns,execAnswer,execName,,AnsNo ,Avoidance,Repetition,Unprepared
_BrownF.B_Q3_17_40,"I think the thing that's so remarkable about the Jack Daniel's share performance in the United States, when you isolate the Black Label brand, is how well it's done when you consider the additions of Jack Daniel's Tennessee Honey and Jack Daniel's Tennessee Fire, as well as Gentleman Jack, as they continued to grow in the United States and Jack Daniel's continued to grow, as well.",Paul Varga,,48,,,
_BrownF.B_Q3_16_21,But here's something you might think about as it relates to Brown-Forman and this American whiskey momentum that exists. And I actually feel like this because we have difficulty even inside of our own company or through our trade system to get our mentality just right on our expectations.,Paul Varga,,49,,,
may31_TAP_Q4_16_15,Many retailers I think are now recognizing that they have got inefficiencies on their shelf sets and too many SKUs which are too specialized and certainly the more sophisticated retailers as would come through 2016 have been asking us for support and building with their approach to Gavin and team have in our category Partnership's actually help many we tellers shift sell shots and drive efficiency and velocity appoint a purchaser think you will see that continue to 2017 and beyond and the people that one that will be the big national craft brands of corporal clarity of positioning and distinctiveness of brands like our will place.,Mark Hunter,,50,,,
ay29const_Q2_16_25,And I also say that our initial 30.5% guidance for the year actually included the benefits that we realized in the second quarter. What we didn't provide and we didn't have clear line of sight into was the timing at which we would receive these benefits.,David Klein,,51,,,
may31_TAP_Q1_16_42,"I think if you work on the basis, about half of the COGS improvement as underlying and continuing and about half of the COGS improvement in the first quarter or something that will fall away because it was a timing benefit - I don't think we whether want to get into any more of the specifics at this stage.",Mark R. Hunter,,52,,,
may31_TAP_Q4_16_10,So Gavin the only thing I would add in and Mark just for information is we wanted the decisions I've made is to take a portion of our synergies and reinvest our back into our business into our global growth team our commercial excellence team in the focused around a handful of areas so we're investing more pretty fundamental segmentation analysis which will inform an awful lot of our portfolio decision-making going forward and that's been done consistently across our business unit.,Mark Hunter,,53,,,
_BrownF.B_Q3_17_4,"In terms of the actual facility and so forth, as you know, we've been investing roughly $15 million behind this facility, which will have its own home place, bottling facility and distillery. And we're about ready to have that commissioned, I think in the springtime, it'll be commissioned. What I mean by that is we'll be producing our whiskey. So it will be ready to go to the market in three or four years from now. So we're excited about that. We're on track and stay tuned, you'll be seeing it soon.",Jane Morreau,,54,,,
may31_TAP_Q1_16_39,"The very specific response, Bryan, is that, no, we haven't disclosed anything in relation to Eden other than our plan to close the brewery. And Gavin and the team are working through the process at this point in time, and it's going as anticipated. I don't know whether, Gavin, you'd want to add anything to that?",Mark R. Hunter,,55,,,
_may31_TSRYY_17_1,"Yes, so Mike you can hear me? Basically we managed the channels very closely so we work with our online partners and try and manage the pricing very closely. We also have a different portfolio for online, there are a few products that are sold online and in traditional retail but we watched those very closely.",Robert Foye,,56,,,
_BrownF.B_Q4_16_21,"And we'll make that more visible as we get closer to it. It's intended to have similar long run and the impact as it relates to bringing focus to our priority brands in that market. It's an excellent risky market; it seems from at least a few of our vantage point to be turning the corner as it relates to their economy and their exposable income relative to what they've been experiencing in the prior few years. So we think it could be well timed to go and make this move, which is familiar terrain for us. And in each instance they've been differently scaled, investments and operations, and as we get closer we'll get the visibility to it. ",Paul Varga,,57,,,
_may29abi_Q4_16_15,"And just to follow-up from your first questions, on the other hand, when we look at '17 with the public information we have, not giving any guidance, but when you read what's out there in terms of macro numbers and what the economists are saying and predicting, we see some facts and some prediction. We see, for example, that inflation continues to go down. So that's a good thing for consumers in general and for us. We see that consumers -- the economists are talking about the GDP to be flat to two consecutive years of declines. So, again, not great news for GDP but much better than we have in the past two years, unemployment also being forecasted to start with reverting in the second half of the year and as consequences disposal income likely to resume growth towards the end of the year again after two very tough years. So, and in this environment that's what we said about be cautiously optimistic about Brazil in terms of beer industry for '17, especially for the second half of the year. So along with that you have the COGS per hectoliter that will evolve throughout the year given that we had our hedges in place and those hedges will get a better place as we go through the quarters especially in second half. So that also will benefit year.",Carlos Brito,,58,,,
may31_TAP_Q1_16_5,"Yeah. Sure. I mean, to your point, Mark, I think, we could spend a lot of the time doing individual diagnosis on 11 different countries. I think, the theme that I will point you to is that, in general, we are increasing our investments in marketing and those investments are playing out well for us with stronger volumes, stronger revenues and premiumizing that portfolio. And actually, that's a factor virtually across all the markets.",Simon Cox,,59,,,
_BrownF.B_Q1_16_51,"Thanks, Paul and just one follow-up and I think you might have addressed this in an earlier question. But just, when you talk about intensifying competition in the US, you are talking about just a lot of new products hitting the market, not price competition or discounting?",Paul Varga,,60,,,
_may31_TSRYY_17_23,And so there's no desperation for us to try and hurriedly sell that inventory. I'd rather do this in a disciplined way and I think that's probably most important word is we are disciplined in how we are approaching the allocation of the lines both Luxury/Masstige on an annual basis and also across regions and channels.,Michael Clarke,,61,,,
ay29const_Q4_17_60,But at this point we're producing and selling all the beer that we can get out -- we're selling all the beer that we can get out of our production facilities.,Rob Sands,,62,,,
may29_DEO_q4_16_28,"Mitch, on scotch pricing, we're going to manage this very, very closely, and it's very market specific. But the broad principles I would say generally in deluxe scotch and above, I don't see us rolling back price. In standard and primary scotches in certain markets where, if we've got currency benefits and we're uncompetitive, we will make adjustments. But then on the other hand, in so-called hard currency markets, like the U.S., I expect our scotch margins to really improve. So we manage it on a global basis. We manage global pricing very tightly.",Ivan Menezes,,63,,,
_BrownF.B_Q1_16_6,"Yes, so, just to give you a flavor, I noted a number of 67% of off-premise distribution for Fire as it related to Jack Daniel's Tennessee Whiskey. As a point of reference, Honey is 81%, and so we know we've got that opportunity to get there as well, as in terms of its on-premise while we've gotten faster in the on-premise, the ratio of Tennessee Honey to Whiskey and Fire to Whiskey is got opportunity to - I mentioned 30% of Honey on the on-premise and - excuse me, Fire on the on-premise and Honey is, I think 39%. So we know we've got distribution opportunities there. All in the US that I am talking about right now to. ",Jane Morreau,,64,,,
may31_TAP_Q2_16_17,"Mark, do you want to come back for the global question? And so, I've asked Stewart to take that - to respond to that. Then if you come back on the global brand piece. So, Stewart, do you want...",Mark Hunter,,65,,,
_BrownF.B_Q2_16_36,"Now, whether or not she'll trade up to Woodford Reserve or Double Oaked, I don't know; but in any event, I think there's a real foundation to the premise that you've suggested there.",Paul Varga,,66,,,
_may29abi_Q1_17_14,"So you're right in terms of building options. And the pricing, normally, we'll do once a year. So again, we don't correct every month. But taxes can change every month, as it did last year. So again, net-net, there is some cycle to be done. VAT is still ahead of price. Market share, if we grew ahead of the industry, should be building those options for us.",Carlos Brito,,67,,,
ay29const_Q4_17_52,"I think so you're going to see a little expansion there. I would say that from an SG&A and marketing perspective, you can assume that that's a percentage of sales, that will remain consistent year-over-year. I will say however considering a lot of other consumer products companies talking about the work that they're doing to take cost out of their business, we're doing all of that same work with a view of being able to redeploy resources to initiatives that are going to continue to drive the topline growth of our business.",Rob Sands,,68,,,
_BrownF.B_Q2_16_20,"We don't like to see other people get consumption that we don't have, but when you have, as our company does today, in our largest markets something like a 6% or 5% market share, and when you have across the globe less than 1% of the market share, you're going to be really frustrated for a long time if you measure yourself on that basis. So we think we can be an enormously successful company, building value for shareholders without having to dominate any particular category or segment. ",Paul Varga,,69,,,
_may31_TSRYY_17_5,"So, we're continuing to focus on how we launched one portfolio at a time and we will probably share more details with you on other potential portfolios at the Investor Day but that's the way you should think about it which means that as you start cycling through the resetting and you start cycling the growth region upon region, you're getting incredible economies of scale with regard to these brands being global, you're getting the margin accretion on those brands but you don't have to keep having resetting the brand portfolio as you go forward.",Michael Clarke,,70,,,
ay29const_Q4_17_13,"So, as we see some of these things improve, I think that you're going to see consumer confidence improve, but you only have to sit around and watch the news to understand that there will continue to be a lot of political uncertainty for the next I guess nobody can, the next is uncertain. The next period of time.",Rob Sands,,71,,,
ay29const_Q4_17_0,"I think of our $2 billion of COGS and beer, there are just a lot of moving parts, things that swing your way things that move in the other direction. I want to just make clear that our guidance implies a peso rate of about 20 pesos to the dollar right, and we know that's running a little bit less than that. It's in the high 18s as we sit here today.",David Klein,,72,,,
may31_TAP_Q4_16_17,Robert some of the big retailers have modified their assortment strategies just address out of stocks and to improve inventory turn. We believe that's the inevitable evolution as Mark said the number of SKUs that been added to the beer category over the past two years so overall we actually agree with that. And in some areas I would say that it has improved our positioning and in some areas it hasn't I think it's coming into 2017 we'll us is that. In its totality. But it's a strategy that we agree with because focus to core packages and provides a healthy balance between out of stocks and variety. ,Mark Hunter,,73,,,
_BrownF.B_Q3_16_35,"I don't think it would be in the best interest of Brown-Forman's long-term value creation to take our eye off of Jack Daniel's Tennessee Whiskey in pursuit of trying to improve Early Times, for example. They are both great brands in their own right, but Jack Daniel's is decidedly more important at Brown-Forman. And so it's something that we would continue to prioritize.",Paul Varga,,74,,,
_may29abi_Q2_16_14,"So the fact that our volume -- the fact that industry volume in China is negative, it's all on the core and value brands or core and value segment brands and that is where the negative is all. If you look at the core-plus, premium and super-premium, they are of course not growing at the same speed they were before, but they're still growing and that's where we have most of our volume anyway. But we still have a 34% of our volumes in non- or below core-plus brands, so core and value. That is why our volume is being impacted, not because of the core-plus brands of ours, premium or super-premium.",Carlos Brito,,75,,,
_BrownF.B_Q4_16_16,"You kind of answered your question. I agree with you, I think there are always strategic considerations. Look we don't have the largest portfolio by any means, and so as a general bias we are brand builders versus brand sellers. And I really do feel like almost any brand in our portfolio we're going decide to do the best job we can with it, and often times they do play strategic roles. ",Paul Varga,,76,,,
_may29abi_Q4_16_43,"Well, in terms of revenue opportunities within SABMiller, I think, one, I mean, we always said that we saw revenue opportunities, we saw core working capital opportunities, but we are not putting a number to it, but we always said that on the revenue side, Robert, global brands was a clear opportunity.",Carlos Brito,,77,,,
ay29const_Q3_17_3,"Yes. So in terms of on-premise and off-premise, our beer business is up high single digits in the on-premise. We think the market's down low to mid single digits in the on-premise. So we are gaining share and feeling very, very comfortable there.",David Klein,,78,,,
_may29abi_Q4_16_18,"In terms of Bud Light, I mean, what's happened in the U.S. is the two prong approach to sales and marketing money. I mean, yes, we continue to invest behind Bud and Bud Light, because those are very important, its core lagers for us in the U.S., but a lot of new money that we're putting in the business are going towards Michelob Ultra, Stella Artois, the craft portfolio. So new initiatives that are really forming the portfolio we need for the next many years.",Carlos Brito,,79,,,
y31_HEINY_Q4_14_21,"The last 20 years have been proving that Nigeria and its political system has been improving, and I maintain that confidence. It is a vibrant -- not flawless -- but a vibrant and strong democracy in Africa; lots of people, also lots of responsible people. Let's not forget that.",Jean-Francois van Boxmeer,,80,,,
_may29abi_Q4_16_37,"The other thing is that in the last three years we've increased our base of sales and marketing big time, double digits way ahead of topline, and of course, from time to time it's a good time to swipe the assets, we always do it, but when we have an event like this where the company gets much bigger you'd tend to have a hard look at where assets and resources are being allocated. But again don't forget that in SG&A 60% of the synergies will show up in that line.",Carlos Brito,,81,,,
y31_HEINY_Q4_14_23,"The oil prices and what foreign effect that will have on the market, that seems to be -- that remains to be seen. And again I'm saying that by having a market share like we have in Nigeria, and the brand portfolio, possibilities of further productivity improvements, and the fact that still Nigeria is low in the consumption per capita in beer, makes the medium and long term we remain just bullish on Nigeria.",Jean-Francois van Boxmeer,,82,,,
31_Pernod_Q2_17_2,"And I think in also discussion that takes place it's an important argument that we obviously are using. As you also know even if some trade agreements could potentially be adapted by the U.S. Russia's WTO rules that apply which are quite positive, I would say around for spirits as there are many tariff rules for spirits in the WTO rules.",Gilles Bogaert,,83,,,
ay29const_Q4_16_18,"So first of all I'll say that Miramar has capacity for about 10 million to 12 million cases. And then beyond that I think we've said in the past that, and Ballast Point has said this, Jim Buechler and his team have discussed looking for a location for an east coast brewery at some point in the future.",David Klein,,84,,,
_Pernod_Q1_1516_57,"In the US, I think again it depends on the Nielson period you look at. If you look at the last 52 weeks, which is the mobile year, then the gross is a bit higher than -- it's 4.4%. So if you consider that the Nielson figures are 1% or 2% above the market, I think it gives an underlying performance which is in the bracket of mid -- of low-to-mid-single-digit top-line growth, as I indicated earlier.",Gilles Bogaert,,85,,,
may29_DEO_q4_16_1,"Hi, Sanjeet. Sure. The distributor agreements are basically focused on strengthening our sales executional capabilities. So things like, we run the activation armies in the top 40 cities, how we support behind the activation army. Things like more focus on multicultural and a non-premise; more focus on reserve brands.",Ivan Menezes,,86,,,
y31_HEINY_Q4_14_32,"The second question was related to our marketing spend. That is not only geared towards innovations; the total marketing and sales support spend, where we say we will slightly increase it. Because we have seen over the last few years that fueling marketing campaigns, sponsorships, innovations, a bit of commercial assertiveness as we call it, it is bringing us to gain market share.",Jean-Francois van Boxmeer,,87,,,
ay29const_Q2_17_7,"Yeah. I don't think that that's really a relevant sort of measure. It's not competing in high-end spirits per se, right? It's really a brand by brand kind of thing. We're going to compete and out-compete the competition with the brands that we have. The whole point of sort of our selection process as we make these sort of smaller tuck-in acquisitions is to buy brands that stand on their own and have the momentum to be of a scale to contribute materially to Constellation's growth and margins. And I am quite confident that High West will be one of those brands as are the other brands in our spirits portfolio. So just like we bought SVEDKA years ago and have grown that to be the second largest vodka in the entire United States and the number one import brand and fundamentally changed the vodka category with that brand, I think that our other spirits additions have a lot of great potential similar to that. So, I guess we don't really think about the - how do we compete effectively in a whole category. We think about what's the quality of the brands that we're buying and how can they contribute to Constellation's continued stellar growth in the top line and the bottom line.",Robert Sands,,88,,,
y31_HEINY_Q4_14_11,"So I am conscious that the outlook on Russia is not bright, but the strategy of continuing focusing on the premium end and the flexibility and resilience that our business unit over there is showing, makes me stay confident in -- for Russia.",Jean-Francois van Boxmeer,,89,,,
ay29const_Q4_16_24,"And we wouldn't use pricing to slow down the business and potentially damage the health of the brands. I can tell you that right now. We have, we believe the capacity necessary to meet the demand in the marketplace. But pricing is an important element of our growth strategy too. So we're going to continue to take the very balanced approach that we've been taking in the past.",Rob Sands,,90,,,
may31_TAP_Q2_16_7,"And then on the third investment, we pushed investment behind our share of voice. We were under indexing. And together with really effective advertising copy, we've seen that now continue to grow our brand scores. So, growing brand scores is a great tell-tale sign that you're spending money in the right place. So, that's how I'd describe the brand expense for Q2.",Stewart Glendinning,,91,,,
ay29const_Q4_17_8,"So, despite the volatility that we're seeing, we're pretty confident in our ability to deliver these numbers.",Rob Sands,,92,,,
_BrownF.B_Q3_17_20,"But we also have talked about this in prior calls, that our costs have gone up somewhat, too. And we talked about the front end with the barrels of those costs, the cost of wood, if you will to make our barrels has gone up. And so that what are the two pieces when I look at the increase once you strip out the BenRiach and the Slane impact. So the volumetric impacts in this is about half of what it is.",Jane Morreau,,93,,,
_BrownF.B_Q4_16_15,"We've been encouraged, I'll tell you from what we've seen not only in the United States, I just feel like we had a great first year there against a pretty tough competitive environment and what we've seen with the competition is not the same in these international market as it is in the United States that Jack Daniel's Tennessee Fire is doing very well and sufficiently enough that we would either expand it within those countries or introduce it in to new countries. ",Paul Varga,,94,,,
may31_TAP_Q1_16_38,"Yeah. Sure. Bryan, as you point out, we closed the deal this quarter. In terms of the timeline, we have up to five years. So, we've got plenty of time to find and build a new brewery. And, of course, that process is actively underway already.",Mark R. Hunter,,95,,,
may31_TAP_Q3_16_31,"I just like to thank everybody for their continued interest at Molson Coors. We've opened a new chapter in the history of our business and as a leadership team, we are delighted to be leading the business forward from this position. And we look forward to updating you as we make our business bigger and stronger in the coming quarters ahead. So thank you for your continued interest in our business. Thanks, everybody.",Mark Hunter,,96,,,
y31_HEINY_Q4_14_9,"And so your question was about our strategy. We are not the market leader in Russia, unlike Nigeria. We -- our portfolio is more geared towards, and we will gear our portfolio more and more towards the higher end of the market, with premium brands, not only Heineken, which despite that the market went down, our Heineken brand went up in Russia, as well as other brands, like Krusovice, other premium brands that we bring to the market and will continue to bring to the market.",Jean-Francois van Boxmeer,,97,,,
_BrownF.B_Q3_17_32,"I mean, I think generally we would anticipate these foreign, you know, significant changes in your route to consumer or something that, you know, might have an impact, we generally see the inventories grow in line with your sales expectations. That's generally what it is. Is there something, Jane, in the...",Paul Varga,,98,,,
_may31_TSRYY_17_46,"There are some operators that have been buying that product with the intention of shipping it to, let's say the continent and then it doesn't leave the U.K and its got back into the U.K. or its stays in the U.K. There has been a clamp down, rightly so by HMRC in the U.K. to stop that sort of that behavior. We have issued a Director to our team that you will stop on the bond sales with immediate effect. I would rather take the pain now and come clean and we will pick up those sales in the future with the correct retailer or distributor buying that product from us with duty paid and that will take place over the - let's say next nine month period.",Michael Clarke,,99,,,
ay29const_Q3_16_20,"Yes, Mark we try not to factor in weather all that much, but clearly a warmer fourth quarter was beneficial I think for our beer business. I would also say that we continued some of the activity that we had been working throughout the first two quarters related to marketing spend along with the NFL and within other venues to continue to drive the brands, but I don't think it's anything outside of those items.",Rob Sands,,100,,,
may31_TAP_Q2_16_38,"Off the top of my head, in Canada, we were down kind of low- to mid-single digits. And then internationally, if you look at our MCI business, we were up double-digit growth. And in the UK and Ireland, we were up double-digits, in fact, kind of high-20%s, low-30% growth. So, Canada, down low- to mid-single; everywhere else outside of Canada, double-digit growth.",Mark Hunter,,101,,,
may29_DEO_q2_15_8,"As you know, our West LAC business, we have been through in the export channels a destocking phase, so I'm confident our business is in good shape in Latin America, we will grow share. And some of those economies, as you know, are still -- growth has been subdued and we won't be immune from that, but I fully expect us to do better and to have decent growth in LAC going into fiscal '16.",Ivan Menezes,,102,,,
ay29const_Q1_16_7,"And once we put them in service, meaning, we have run beer down the line or beer through the brew house for commercial sale, we then put those assets into service, which means we begin depreciation.",David Klein,,103,,,
